{
  "checks": [
    {
      "check": "project.parses",
      "message": "project.yaml parses",
      "status": "passed"
    },
    {
      "check": "project.conforms_to_schema",
      "message": "project.yaml conforms to the packaged OpenMapStack v1 JSON Schema",
      "status": "passed"
    },
    {
      "check": "project.graph_resolves",
      "message": "graph resolves: 4 steps, 4 produced symbols, 1 outputs all traced to real steps",
      "status": "passed"
    },
    {
      "check": "project.one_canonical_pipeline",
      "message": "pipeline.py is the canonical implementation; wrappers import it",
      "status": "passed"
    },
    {
      "check": "project.assumptions_have_rationale",
      "message": "all 1 assumptions have statement + rationale",
      "status": "passed"
    },
    {
      "check": "project.status_agrees_with_validation_report",
      "message": "project.status 'warning' agrees with report status 'warning'",
      "status": "passed"
    },
    {
      "args": {
        "files": [
          "data/derived/district-counts.geojson"
        ]
      },
      "check": "project.declared_files_exist",
      "message": "all 1 declared files exist",
      "status": "passed"
    },
    {
      "check": "provenance.every_source_has_provider_and_access",
      "message": "all 2 sources declare provider + access method + retrieval timestamp",
      "status": "passed"
    },
    {
      "check": "provenance.every_source_pinned",
      "message": "all 2 sources are pinned (version_identity)",
      "status": "passed"
    },
    {
      "check": "provenance.no_inline_credentials",
      "message": "no inline credentials in 2 sources; connections are by reference",
      "status": "passed"
    },
    {
      "check": "provenance.license_present_where_required",
      "message": "license metadata present for required sources",
      "status": "passed"
    },
    {
      "check": "provenance.rationale_present",
      "message": "all 2 sources document selection rationale",
      "status": "passed"
    },
    {
      "check": "overrides.every_override_has_provenance",
      "message": "all 1 overrides carry id/action/rationale/author/timestamp",
      "status": "passed"
    },
    {
      "check": "overrides.evidence_not_placeholder",
      "message": "no placeholder evidence found",
      "status": "passed"
    },
    {
      "check": "validation.required_all_present",
      "message": "all 3 declared checks present exactly once in report",
      "status": "passed"
    },
    {
      "check": "validation.no_implicit_pass",
      "message": "every check has an explicit status",
      "status": "passed"
    },
    {
      "check": "validation.warning_or_failed_propagates_to_status",
      "message": "overall status 'warning' correctly reflects check statuses",
      "status": "passed"
    },
    {
      "check": "validation.run_record_matches",
      "message": "report run_id 'run-20260901-000001' matches a real run record with consistent hashes",
      "status": "passed"
    },
    {
      "args": {
        "check": "geodata.feature_field_equals",
        "equals": 2,
        "field": "facility_count",
        "id": "D1",
        "id_field": "district_id",
        "path": "data/derived/district-counts.geojson"
      },
      "check": "expectation.d1-count",
      "code": "expectation_unverified",
      "evidence": {
        "class": "unverified",
        "expected_expectation_sha256": "$DIGEST"
      },
      "message": "expectation 'd1-count' is unverified; independent review must bind expectation_sha256 to sha256:$DIGEST",
      "status": "warning"
    },
    {
      "check": "geodata.crs_not_used_for_metrics",
      "message": "analysis_crs EPSG:3301 is valid for 0 metric operation(s); storage/load/reprojection steps were excluded",
      "status": "passed"
    },
    {
      "args": {
        "path": "data/derived/district-counts.geojson"
      },
      "check": "geodata.geometry_all_valid",
      "message": "data/derived/district-counts.geojson: all 2 features have valid geometry",
      "status": "passed"
    },
    {
      "args": {
        "path": "data/derived/district-counts.geojson"
      },
      "check": "geodata.dataset_crs_is",
      "code": "crs_undeclared",
      "message": "output 'district_counts' declares no EPSG code in its format string, so its real CRS cannot be cross-checked",
      "status": "not_testable"
    },
    {
      "check": "presentation.layers_use_semantic_roles",
      "message": "all 2 layers declare a semantic_role",
      "status": "passed"
    },
    {
      "check": "presentation.controls_match_pipeline",
      "message": "0 filter control(s) and 0 scenario control(s) consistent",
      "status": "passed"
    },
    {
      "check": "presentation.edit_targets_reference_real_sources",
      "message": "no edit targets declared (vacuously true)",
      "status": "passed"
    },
    {
      "check": "rerun.no_chat_dependency",
      "message": "canonical project dependencies contain no chat/transcript references",
      "status": "passed"
    }
  ],
  "counts": {
    "failed": 0,
    "not_testable": 1,
    "passed": 24,
    "warning": 1
  },
  "coverage": {
    "applicable": 26,
    "executed": 25,
    "execution_rate": 0.9615384615384616,
    "not_testable": 1
  },
  "project_file": "$PROJECT/project.yaml",
  "schema": "openmapstack-verify-result/v1",
  "status": "warning"
}
